{
  "stage": "1_premise",
  "schema_version": "1.0.0",
  "run_id": "backlog_rag_attribution",
  "raw_premise": "Design a study to evaluate whether inline citation attribution in RAG-based AI answers changes user verification behavior.",
  "sharpest_question": "Changes verification behavior in which direction, under what conditions, and for which users — because 'changes' is not a claim, it is a fishing expedition, and the study design cannot be specified until you have a directional hypothesis grounded in a mechanism.",
  "claim": "Unstated. The premise would need to assert something like: inline citations reduce verification effort (automation bias), or inline citations increase verification frequency (accountability salience), or inline citations shift verification from full-answer checks to source-specific spot-checks. Without a directional claim, there is no study to design.",
  "differentia": "Not visible in the premise. There is substantial prior work on trust calibration in AI-assisted tasks, on automation bias with explanations, and on source credibility cues in information retrieval. The specific mechanism by which RAG citation format (inline vs. footnote vs. none) interacts with verification behavior has not been isolated — but the premise does not demonstrate awareness of that gap, and therefore does not establish that this study occupies it.",
  "nearest_template": "Explanations-and-trust studies in AI-assisted decision-making (e.g., the XAI overreliance literature: Buccinca et al., Springer et al.); also source-cue credibility studies in web search and misinformation contexts. The nearest template is: give users an AI output with varying explanation types, measure task accuracy and self-reported trust, operationalize reliance as outcome. This premise maps almost exactly onto that template with 'inline citation' substituted for 'explanation.'",
  "missing_evidence": [
    "A directional hypothesis or mechanistic account: does the researcher expect citations to increase or decrease verification, and why? Automation bias predicts decrease; accountability salience predicts increase; source quality variance predicts conditional effects. Pick one.",
    "A definition of 'verification behavior' that is operationalizable: does this mean click-through to the cited source, cross-referencing a second source, self-reported confidence change, task accuracy on follow-up questions, or something else? Each operationalization tests a different construct.",
    "A characterization of the population: RAG systems are used in enterprise search, consumer Q&A, coding assistants, and clinical decision support — verification norms and stakes differ radically across these. The premise treats 'users' as a homogeneous mass.",
    "An account of the citation format variable: inline attribution is not a single treatment — it varies by source type (URL, document title, author), placement (sentence-level vs. paragraph-level), and verifiability (live link vs. static label). The premise has not specified what it is actually manipulating.",
    "Acknowledgment of confounds: answer quality and citation presence are correlated in real RAG outputs. If higher-confidence retrievals get citations, any behavioral effect may be driven by answer quality rather than citation format. How will the study control for this?"
  ],
  "sharpened_options": [
    "Territory: RAG systems are deployed in high-stakes information tasks where answer accuracy is consequential but users cannot assess accuracy without external verification. Niche: XAI overreliance studies show that explanations reduce verification effort even when explanations are unreliable — but these use model-internal rationales, not retrieved external sources; whether external-source citations trigger different reliance patterns is untested. Occupation: We claim that inline citations to named external sources will reduce overall verification frequency (automation bias) but increase source-specific spot-checking, net-reducing the probability that users detect factual errors embedded in cited claims. Study design: 2x2 between-subjects (citation present/absent × answer correctness) with behavioral verification logging and accuracy-on-transfer as DV.",
    "Territory: Consumer-facing AI assistants are increasingly used for health and financial queries where source credibility is a meaningful signal. Niche: Source credibility research in web search shows domain-name cues affect click behavior, but RAG citations embed source labels inside generated prose rather than as discrete links — the credibility-cue mechanism may not transfer. Occupation: We claim that citation source quality (high-credibility vs. low-credibility domain) moderates users' willingness to verify, such that low-credibility citations paradoxically suppress verification by satisfying users' need for attribution without warranting it. Study: within-subjects citation-quality manipulation with think-aloud and click-trace.",
    "Territory: Enterprise knowledge workers use RAG-based internal search where documents are known to be authoritative but may be outdated. Niche: Verification behavior in enterprise AI tools is understudied relative to consumer contexts; workers may apply different verification heuristics when they recognize cited sources from their own organization. Occupation: We claim that source familiarity (user has prior exposure to the cited document) mediates verification behavior: familiar sources are trusted without verification more often than unfamiliar sources, regardless of citation presence, producing a personalization effect not captured by current citation-design guidelines. Study: log-based field study with post-hoc familiarity survey in an enterprise RAG deployment.",
    "Territory: Fact-checking and lateral reading research shows that expert verifiers leave the page immediately to assess source credibility, while novices evaluate content in-place. Niche: It is unknown whether inline citations in AI-generated answers shift novice users toward expert-like lateral reading or whether they substitute for it by creating an appearance of sourcing. Occupation: We claim that inline citations increase novice users' self-reported confidence without increasing actual lateral reading behavior, widening the calibration gap between perceived and actual answer reliability. Study: eye-tracking and tab-logging study with calibration measured as correlation between confidence ratings and answer accuracy scores."
  ],
  "provenance": {
    "raw_premise": "RESEARCHER_INPUT",
    "analysis": "AGENT_INFERENCE"
  }
}
